{
  "schema_version": "0.1.0",
  "marker_id": "tensor_runtime:local-deterministic-fixture-tensor-runtime:0.1.0",
  "target": {
    "kind": "tensor_runtime",
    "id": "local-deterministic-fixture-tensor-runtime"
  },
  "version_identity": "step-3-local-fixture-runtime; uncommitted workspace hash identity",
  "standard_hash": "C575EFD954ED4F3F10E063B110A1EB6CF28D01438904849E43D6A500FB0E49C5",
  "reviews": [
    {
      "reviewer": "codex-local-runtime",
      "timestamp_utc": "2026-07-20T21:55:00Z",
      "result": "no_blocking_objection",
      "notes": "Local fixture verification passed and produced hash-bound evidence.",
      "evidence": {
        "kind": "builder-local-run",
        "message_hashes": []
      }
    },
    {
      "reviewer": "claude-independent-review",
      "timestamp_utc": "2026-07-20T21:55:27Z",
      "result": "no_blocking_objection",
      "notes": "Independent read/run/hash verification confirmed the provisional marker mechanism, while noting that two reviewers is still below a full redundancy threshold.",
      "evidence": {
        "kind": "peer-bridge-independent-review",
        "message_hashes": [
          "853E3461B3E46063A184385B36A1D1009C8741016E669F01F93E8921891B4B62",
          "91C4C59AD97C04F2259F5CA772FEB809F29951A05BE3559F9405242743224722"
        ]
      }
    }
  ],
  "working_parameters": {
    "scope": "local fixture records only",
    "pod_state_effect": "unchanged",
    "outside_parameters_behavior": "report visible condition and leave Pod state unchanged"
  },
  "trust_state": "provisional",
  "hashes": {
    "schema_hash": "F8ADB649FCEF697701AE08293B8D8535551A0CD95846D59E50D576B6495434B8",
    "implementation_hash": "98BD7993B95E5D725FE1E327417C6B885429E831062859EC420BF3FA73EB4AD9",
    "demo_hash": "0A90A29464B6FCC5256B946C3E5C05863D4A9B22F1624BDF8BE2F4E96B0D5F48",
    "test_result_hash": "2256EF4C877C98E7FAA2EACBD6841ED2FE1016746A2746C2B6501982A87B4D54"
  },
  "verification": {
    "commands": [
      {
        "command": "python scripts\\validate_contracts.py",
        "result": "pass"
      },
      {
        "command": "python -m unittest discover -s tests -v",
        "result": "pass"
      },
      {
        "command": "python -m src.aegis_pod.tensor_runtime --root .",
        "result": "pass"
      }
    ],
    "evidence_paths": [
      "reports/runtime/2026-07-20-step-3-tensor-runtime-evidence.md",
      "reports/runtime/tensor-health.json",
      "reports/runtime/tensors/PEER.tensor.json",
      "reports/runtime/tensors/PCT.tensor.json",
      "reports/runtime/tensors/NCT.tensor.json",
      "reports/runtime/tensors/SPINE.tensor.json"
    ],
    "live_reach": false
  },
  "claim_boundary": {
    "demonstrates": [
      "Local deterministic numeric tensor computation from fixture tensor records.",
      "Stable shape, dtype, record index, and source-hash sensitivity for fixture records."
    ],
    "outside_current_verified_surface": [
      "Semantic embedding inference.",
      "Live DataQuad tensorization.",
      "Migration execution."
    ]
  }
}
